#
# WL#vector-v1: MVCC visibility for vector DML synchronization
#
DROP TABLE IF EXISTS t_vec_mvcc;
Warnings:
Note	1051	Unknown table 'test.t_vec_mvcc'
CREATE TABLE t_vec_mvcc (
id INT PRIMARY KEY,
v VECTOR(2)
) ENGINE=InnoDB;
CREATE VECTOR INDEX ON t_vec_mvcc(v) WITH (2);
SET @mvcc_candidates_before = (
SELECT CAST(VARIABLE_VALUE AS UNSIGNED)
FROM performance_schema.global_status
WHERE VARIABLE_NAME = 'Vector_search_mvcc_candidate_rows');
INSERT INTO t_vec_mvcc VALUES (1, VEC_FROMTEXT('[1,1]'));
SELECT JSON_CONTAINS(
VEC_INDEX_SEARCH('test.t_vec_mvcc.v', '[1,1]', 8), CAST(1 AS JSON));
JSON_CONTAINS(
VEC_INDEX_SEARCH('test.t_vec_mvcc.v', '[1,1]', 8), CAST(1 AS JSON))
1
START TRANSACTION;
INSERT INTO t_vec_mvcc VALUES (2, VEC_FROMTEXT('[2,2]'));
SELECT JSON_CONTAINS(
VEC_INDEX_SEARCH('test.t_vec_mvcc.v', '[2,2]', 8), CAST(2 AS JSON));
JSON_CONTAINS(
VEC_INDEX_SEARCH('test.t_vec_mvcc.v', '[2,2]', 8), CAST(2 AS JSON))
1
SELECT JSON_CONTAINS(
VEC_INDEX_SEARCH('test.t_vec_mvcc.v', '[2,2]', 8), CAST(2 AS JSON));
JSON_CONTAINS(
VEC_INDEX_SEARCH('test.t_vec_mvcc.v', '[2,2]', 8), CAST(2 AS JSON))
0
COMMIT;
SELECT JSON_CONTAINS(
VEC_INDEX_SEARCH('test.t_vec_mvcc.v', '[2,2]', 8), CAST(2 AS JSON));
JSON_CONTAINS(
VEC_INDEX_SEARCH('test.t_vec_mvcc.v', '[2,2]', 8), CAST(2 AS JSON))
1
START TRANSACTION;
INSERT INTO t_vec_mvcc VALUES (3, VEC_FROMTEXT('[3,3]'));
SELECT JSON_CONTAINS(
VEC_INDEX_SEARCH('test.t_vec_mvcc.v', '[3,3]', 8), CAST(3 AS JSON));
JSON_CONTAINS(
VEC_INDEX_SEARCH('test.t_vec_mvcc.v', '[3,3]', 8), CAST(3 AS JSON))
1
SELECT JSON_CONTAINS(
VEC_INDEX_SEARCH('test.t_vec_mvcc.v', '[3,3]', 8), CAST(3 AS JSON));
JSON_CONTAINS(
VEC_INDEX_SEARCH('test.t_vec_mvcc.v', '[3,3]', 8), CAST(3 AS JSON))
0
ROLLBACK;
SELECT JSON_CONTAINS(
VEC_INDEX_SEARCH('test.t_vec_mvcc.v', '[3,3]', 8), CAST(3 AS JSON));
JSON_CONTAINS(
VEC_INDEX_SEARCH('test.t_vec_mvcc.v', '[3,3]', 8), CAST(3 AS JSON))
0
START TRANSACTION;
UPDATE t_vec_mvcc SET v=VEC_FROMTEXT('[9,9]') WHERE id=1;
SELECT VEC_INDEX_SEARCH('test.t_vec_mvcc.v', '[9,9]', 1);
VEC_INDEX_SEARCH('test.t_vec_mvcc.v', '[9,9]', 1)
[1]
SELECT VEC_INDEX_SEARCH('test.t_vec_mvcc.v', '[9,9]', 1);
VEC_INDEX_SEARCH('test.t_vec_mvcc.v', '[9,9]', 1)
[2]
COMMIT;
SELECT VEC_INDEX_SEARCH('test.t_vec_mvcc.v', '[9,9]', 1);
VEC_INDEX_SEARCH('test.t_vec_mvcc.v', '[9,9]', 1)
[1]
START TRANSACTION;
DELETE FROM t_vec_mvcc WHERE id=1;
SELECT VEC_INDEX_SEARCH('test.t_vec_mvcc.v', '[9,9]', 1);
VEC_INDEX_SEARCH('test.t_vec_mvcc.v', '[9,9]', 1)
[2]
SELECT VEC_INDEX_SEARCH('test.t_vec_mvcc.v', '[9,9]', 1);
VEC_INDEX_SEARCH('test.t_vec_mvcc.v', '[9,9]', 1)
[1]
COMMIT;
SELECT VEC_INDEX_SEARCH('test.t_vec_mvcc.v', '[9,9]', 1);
VEC_INDEX_SEARCH('test.t_vec_mvcc.v', '[9,9]', 1)
[2]
START TRANSACTION;
INSERT INTO t_vec_mvcc VALUES (5, VEC_FROMTEXT('[5,5]'));
SAVEPOINT sp_search;
DELETE FROM t_vec_mvcc WHERE id=5;
SELECT JSON_CONTAINS(
VEC_INDEX_SEARCH('test.t_vec_mvcc.v', '[5,5]', 8), CAST(5 AS JSON));
JSON_CONTAINS(
VEC_INDEX_SEARCH('test.t_vec_mvcc.v', '[5,5]', 8), CAST(5 AS JSON))
0
ROLLBACK TO SAVEPOINT sp_search;
SELECT JSON_CONTAINS(
VEC_INDEX_SEARCH('test.t_vec_mvcc.v', '[5,5]', 8), CAST(5 AS JSON));
JSON_CONTAINS(
VEC_INDEX_SEARCH('test.t_vec_mvcc.v', '[5,5]', 8), CAST(5 AS JSON))
1
ROLLBACK;
SET @mvcc_candidates_after = (
SELECT CAST(VARIABLE_VALUE AS UNSIGNED)
FROM performance_schema.global_status
WHERE VARIABLE_NAME = 'Vector_search_mvcc_candidate_rows');
include/assert.inc [mapped MVCC search records candidate rows]
DROP VECTOR INDEX ON t_vec_mvcc(v);
DROP TABLE t_vec_mvcc;
